[
  {
    "schema_version": "1.0.0",
    "signal": "ACC_CancelReq_Flg",
    "channel_group": "ACC_HMI_10Hz",
    "table": "acc_hmi_10hz",
    "unit": "",
    "dtype": "uint8",
    "column_type": "int32",
    "raster_hz": 10,
    "role": "response",
    "source_spec": "acc_stim/mf4/signals.py (plant tool acc_stim 0.2.0, asammdf 8.8.9)"
  },
  {
    "schema_version": "1.0.0",
    "signal": "ACC_DrvOvrd_Enum",
    "channel_group": "ACC_HMI_10Hz",
    "table": "acc_hmi_10hz",
    "unit": "",
    "dtype": "uint8",
    "column_type": "int32",
    "raster_hz": 10,
    "role": "diagnostic",
    "source_spec": "acc_stim/mf4/signals.py (plant tool acc_stim 0.2.0, asammdf 8.8.9)"
  },
  {
    "schema_version": "1.0.0",
    "signal": "ACC_FltCode_Enum",
    "channel_group": "ACC_HMI_10Hz",
    "table": "acc_hmi_10hz",
    "unit": "",
    "dtype": "uint8",
    "column_type": "int32",
    "raster_hz": 10,
    "role": "diagnostic",
    "source_spec": "acc_stim/mf4/signals.py (plant tool acc_stim 0.2.0, asammdf 8.8.9)"
  },
  {
    "schema_version": "1.0.0",
    "signal": "ACC_HoldActive_Flg",
    "channel_group": "ACC_HMI_10Hz",
    "table": "acc_hmi_10hz",
    "unit": "",
    "dtype": "uint8",
    "column_type": "int32",
    "raster_hz": 10,
    "role": "response",
    "source_spec": "acc_stim/mf4/signals.py (plant tool acc_stim 0.2.0, asammdf 8.8.9)"
  },
  {
    "schema_version": "1.0.0",
    "signal": "ACC_MainSw_Flg",
    "channel_group": "ACC_HMI_10Hz",
    "table": "acc_hmi_10hz",
    "unit": "",
    "dtype": "uint8",
    "column_type": "int32",
    "raster_hz": 10,
    "role": "diagnostic",
    "source_spec": "acc_stim/mf4/signals.py (plant tool acc_stim 0.2.0, asammdf 8.8.9)"
  },
  {
    "schema_version": "1.0.0",
    "signal": "ACC_ResumeReq_Flg",
    "channel_group": "ACC_HMI_10Hz",
    "table": "acc_hmi_10hz",
    "unit": "",
    "dtype": "uint8",
    "column_type": "int32",
    "raster_hz": 10,
    "role": "response",
    "source_spec": "acc_stim/mf4/signals.py (plant tool acc_stim 0.2.0, asammdf 8.8.9)"
  },
  {
    "schema_version": "1.0.0",
    "signal": "ACC_SetSpd_Kph",
    "channel_group": "ACC_HMI_10Hz",
    "table": "acc_hmi_10hz",
    "unit": "km/h",
    "dtype": "float32",
    "column_type": "double",
    "raster_hz": 10,
    "role": "response",
    "source_spec": "acc_stim/mf4/signals.py (plant tool acc_stim 0.2.0, asammdf 8.8.9)"
  },
  {
    "schema_version": "1.0.0",
    "signal": "ACC_Status",
    "channel_group": "ACC_HMI_10Hz",
    "table": "acc_hmi_10hz",
    "unit": "",
    "dtype": "uint8",
    "column_type": "int32",
    "raster_hz": 10,
    "role": "response",
    "source_spec": "acc_stim/mf4/signals.py (plant tool acc_stim 0.2.0, asammdf 8.8.9)",
    "enum_map": {
      "0": "Off",
      "1": "Standby",
      "2": "Active-Cruise",
      "3": "Active-Follow",
      "4": "Active-Hold",
      "5": "Driver-Override",
      "6": "Degraded/Fault"
    }
  },
  {
    "schema_version": "1.0.0",
    "signal": "ACC_TimeGapSet",
    "channel_group": "ACC_HMI_10Hz",
    "table": "acc_hmi_10hz",
    "unit": "",
    "dtype": "uint8",
    "column_type": "int32",
    "raster_hz": 10,
    "role": "response",
    "source_spec": "acc_stim/mf4/signals.py (plant tool acc_stim 0.2.0, asammdf 8.8.9)"
  },
  {
    "schema_version": "1.0.0",
    "signal": "ACC_TimeGapSet_s",
    "channel_group": "ACC_HMI_10Hz",
    "table": "acc_hmi_10hz",
    "unit": "s",
    "dtype": "float32",
    "column_type": "double",
    "raster_hz": 10,
    "role": "response",
    "source_spec": "acc_stim/mf4/signals.py (plant tool acc_stim 0.2.0, asammdf 8.8.9)"
  },
  {
    "schema_version": "1.0.0",
    "signal": "ACC_TrgtDetd_Flg",
    "channel_group": "ACC_HMI_10Hz",
    "table": "acc_hmi_10hz",
    "unit": "",
    "dtype": "uint8",
    "column_type": "int32",
    "raster_hz": 10,
    "role": "response",
    "source_spec": "acc_stim/mf4/signals.py (plant tool acc_stim 0.2.0, asammdf 8.8.9)"
  },
  {
    "schema_version": "1.0.0",
    "signal": "ACC_Warn_Enum",
    "channel_group": "ACC_HMI_10Hz",
    "table": "acc_hmi_10hz",
    "unit": "",
    "dtype": "uint8",
    "column_type": "int32",
    "raster_hz": 10,
    "role": "diagnostic",
    "source_spec": "acc_stim/mf4/signals.py (plant tool acc_stim 0.2.0, asammdf 8.8.9)"
  },
  {
    "schema_version": "1.0.0",
    "signal": "AccelReq_mps2",
    "channel_group": "PT_CAN_100Hz",
    "table": "acc_pt_can_100hz",
    "unit": "m/s^2",
    "dtype": "float32",
    "column_type": "double",
    "raster_hz": 100,
    "role": "response",
    "source_spec": "acc_stim/mf4/signals.py (plant tool acc_stim 0.2.0, asammdf 8.8.9)"
  },
  {
    "schema_version": "1.0.0",
    "signal": "BrkLmpReq_Flg",
    "channel_group": "PT_CAN_100Hz",
    "table": "acc_pt_can_100hz",
    "unit": "",
    "dtype": "uint8",
    "column_type": "int32",
    "raster_hz": 100,
    "role": "response",
    "source_spec": "acc_stim/mf4/signals.py (plant tool acc_stim 0.2.0, asammdf 8.8.9)"
  },
  {
    "schema_version": "1.0.0",
    "signal": "BrkLmp_Actv_Flg",
    "channel_group": "PT_CAN_100Hz",
    "table": "acc_pt_can_100hz",
    "unit": "",
    "dtype": "uint8",
    "column_type": "int32",
    "raster_hz": 100,
    "role": "response",
    "source_spec": "acc_stim/mf4/signals.py (plant tool acc_stim 0.2.0, asammdf 8.8.9)"
  },
  {
    "schema_version": "1.0.0",
    "signal": "BrkPress_Bar",
    "channel_group": "PT_CAN_100Hz",
    "table": "acc_pt_can_100hz",
    "unit": "bar",
    "dtype": "float32",
    "column_type": "double",
    "raster_hz": 100,
    "role": "response",
    "source_spec": "acc_stim/mf4/signals.py (plant tool acc_stim 0.2.0, asammdf 8.8.9)"
  },
  {
    "schema_version": "1.0.0",
    "signal": "BrkReq_mps2",
    "channel_group": "PT_CAN_100Hz",
    "table": "acc_pt_can_100hz",
    "unit": "m/s^2",
    "dtype": "float32",
    "column_type": "double",
    "raster_hz": 100,
    "role": "response",
    "source_spec": "acc_stim/mf4/signals.py (plant tool acc_stim 0.2.0, asammdf 8.8.9)"
  },
  {
    "schema_version": "1.0.0",
    "signal": "DrvAccPedal_Pct",
    "channel_group": "PT_CAN_100Hz",
    "table": "acc_pt_can_100hz",
    "unit": "%",
    "dtype": "float32",
    "column_type": "double",
    "raster_hz": 100,
    "role": "stimulus",
    "source_spec": "acc_stim/mf4/signals.py (plant tool acc_stim 0.2.0, asammdf 8.8.9)"
  },
  {
    "schema_version": "1.0.0",
    "signal": "DrvBrkPedal_Pct",
    "channel_group": "PT_CAN_100Hz",
    "table": "acc_pt_can_100hz",
    "unit": "%",
    "dtype": "float32",
    "column_type": "double",
    "raster_hz": 100,
    "role": "stimulus",
    "source_spec": "acc_stim/mf4/signals.py (plant tool acc_stim 0.2.0, asammdf 8.8.9)"
  },
  {
    "schema_version": "1.0.0",
    "signal": "EgoDist_m",
    "channel_group": "PT_CAN_100Hz",
    "table": "acc_pt_can_100hz",
    "unit": "m",
    "dtype": "float32",
    "column_type": "double",
    "raster_hz": 100,
    "role": "response",
    "source_spec": "acc_stim/mf4/signals.py (plant tool acc_stim 0.2.0, asammdf 8.8.9)"
  },
  {
    "schema_version": "1.0.0",
    "signal": "EngTrqReq_Nm",
    "channel_group": "PT_CAN_100Hz",
    "table": "acc_pt_can_100hz",
    "unit": "Nm",
    "dtype": "float32",
    "column_type": "double",
    "raster_hz": 100,
    "role": "response",
    "source_spec": "acc_stim/mf4/signals.py (plant tool acc_stim 0.2.0, asammdf 8.8.9)"
  },
  {
    "schema_version": "1.0.0",
    "signal": "Obj2_Azimuth_deg",
    "channel_group": "RADAR_OBJ_50Hz",
    "table": "acc_radar_obj_50hz",
    "unit": "deg",
    "dtype": "float32",
    "column_type": "double",
    "raster_hz": 50,
    "role": "stimulus",
    "source_spec": "acc_stim/mf4/signals.py (plant tool acc_stim 0.2.0, asammdf 8.8.9)"
  },
  {
    "schema_version": "1.0.0",
    "signal": "Obj2_Dist_m",
    "channel_group": "RADAR_OBJ_50Hz",
    "table": "acc_radar_obj_50hz",
    "unit": "m",
    "dtype": "float32",
    "column_type": "double",
    "raster_hz": 50,
    "role": "stimulus",
    "source_spec": "acc_stim/mf4/signals.py (plant tool acc_stim 0.2.0, asammdf 8.8.9)"
  },
  {
    "schema_version": "1.0.0",
    "signal": "Obj2_ID",
    "channel_group": "RADAR_OBJ_50Hz",
    "table": "acc_radar_obj_50hz",
    "unit": "",
    "dtype": "uint16",
    "column_type": "int32",
    "raster_hz": 50,
    "role": "diagnostic",
    "source_spec": "acc_stim/mf4/signals.py (plant tool acc_stim 0.2.0, asammdf 8.8.9)"
  },
  {
    "schema_version": "1.0.0",
    "signal": "Obj2_InLane_Flg",
    "channel_group": "RADAR_OBJ_50Hz",
    "table": "acc_radar_obj_50hz",
    "unit": "",
    "dtype": "uint8",
    "column_type": "int32",
    "raster_hz": 50,
    "role": "stimulus",
    "source_spec": "acc_stim/mf4/signals.py (plant tool acc_stim 0.2.0, asammdf 8.8.9)"
  },
  {
    "schema_version": "1.0.0",
    "signal": "Obj2_LatOfs_m",
    "channel_group": "RADAR_OBJ_50Hz",
    "table": "acc_radar_obj_50hz",
    "unit": "m",
    "dtype": "float32",
    "column_type": "double",
    "raster_hz": 50,
    "role": "stimulus",
    "source_spec": "acc_stim/mf4/signals.py (plant tool acc_stim 0.2.0, asammdf 8.8.9)"
  },
  {
    "schema_version": "1.0.0",
    "signal": "Obj2_ObjType_Enum",
    "channel_group": "RADAR_OBJ_50Hz",
    "table": "acc_radar_obj_50hz",
    "unit": "",
    "dtype": "uint8",
    "column_type": "int32",
    "raster_hz": 50,
    "role": "diagnostic",
    "source_spec": "acc_stim/mf4/signals.py (plant tool acc_stim 0.2.0, asammdf 8.8.9)",
    "enum_map": {
      "0": "none",
      "1": "moving",
      "2": "slow-moving",
      "3": "stationary"
    }
  },
  {
    "schema_version": "1.0.0",
    "signal": "Obj2_RelSpd_mps",
    "channel_group": "RADAR_OBJ_50Hz",
    "table": "acc_radar_obj_50hz",
    "unit": "m/s",
    "dtype": "float32",
    "column_type": "double",
    "raster_hz": 50,
    "role": "stimulus",
    "source_spec": "acc_stim/mf4/signals.py (plant tool acc_stim 0.2.0, asammdf 8.8.9)"
  },
  {
    "schema_version": "1.0.0",